{"schema_version":"1.0.0","execucao_id":"EXEC-FICTICIA-001","processo":null,"timestamp":"2026-08-10T12:00:00-03:00","agente":"Codex","skill":"auditoria-pericial-integrada","objetivo":"Teste sintético","inputs":[],"fontes":[],"artefatos":[],"decisoes_autonomas":[],"inferencias":[],"pesquisas_online":[],"normas_utilizadas":[],"modelos_utilizados":[],"outputs":[],"auditorias":[],"achados":[],"correcoes":[],"validacoes_humanas":[],"status":"APROVADO","proveniencia":[]}
